{
  "name": "Alakazam",
  "stage": "Stage 2",
  "evolvesFrom": "Kadabra",
  "hp": 140,
  "types": [
    "Psychic"
  ],
  "stamps": [],
  "promo": {
    "isPromo": false,
    "series": "",
    "promoNumber": ""
  },
  "number": "056/132",
  "set": {
    "name": "Mega Evolution",
    "code": "MEG",
    "total": 132,
    "symbolCode": ""
  },
  "setboxLetters": "MEG",
  "printYear": 2025,
  "illustrator": "Bun Toujo",
  "text": {
    "abilities": [
      {
        "name": "Psychic Draw",
        "text": "Once during your turn, when you play this Pok\u00e9mon from your hand to evolve 1 of your Pok\u00e9mon, you may use this Ability. Draw 3 cards.",
        "kind": "Ability"
      }
    ],
    "attacks": [
      {
        "name": "Powerful Hand",
        "cost": [],
        "damage": "0",
        "text": "Place 2 damage counters on your opponent's Active Pok\u00e9mon for each card in your hand."
      }
    ],
    "weaknesses": [
      {
        "type": "Psychic",
        "value": "\u00d72"
      }
    ],
    "resistances": [
      {
        "type": "Fighting",
        "value": "-30"
      }
    ],
    "retreatCost": [
      "Colorless"
    ]
  },
  "notes": {
    "unreadable": []
  },
  "_confidence": {
    "name": 0.95,
    "stage": 0.95,
    "evolvesFrom": 0.95,
    "hp": 0.95,
    "types": 0.95,
    "number": 0.95,
    "set": 0.95,
    "setboxLetters": 0.95,
    "printYear": 0.95,
    "illustrator": 0.95,
    "text": 0.95
  }
}