{
  "name": "Steelix",
  "stage": "Stage 1",
  "evolvesFrom": "Onix",
  "hp": 200,
  "types": [
    "Metal"
  ],
  "stamps": [],
  "promo": {
    "isPromo": false,
    "series": "",
    "promoNumber": ""
  },
  "number": "093/132",
  "set": {
    "name": "Unknown",
    "code": "MEG",
    "total": 132,
    "symbolCode": ""
  },
  "setboxLetters": "MEG",
  "printYear": 2025,
  "illustrator": "Anesaki Dynamic",
  "text": {
    "abilities": [],
    "attacks": [
      {
        "name": "Welcoming Tail",
        "cost": [
          "Colorless",
          "Colorless"
        ],
        "damage": "40+",
        "text": "If you have exactly 6 Prize cards remaining, this attack does 200 more damage."
      },
      {
        "name": "Skull Bash",
        "cost": [
          "Colorless",
          "Colorless",
          "Colorless"
        ],
        "damage": "140",
        "text": ""
      }
    ],
    "weaknesses": [
      {
        "type": "Fire",
        "value": "\u00d72"
      }
    ],
    "resistances": [
      {
        "type": "Lightning",
        "value": "-30"
      }
    ],
    "retreatCost": [
      "Colorless",
      "Colorless",
      "Colorless",
      "Colorless"
    ]
  },
  "notes": {
    "unreadable": []
  },
  "_confidence": {
    "name": 0.95,
    "stage": 0.95,
    "evolvesFrom": 0.95,
    "hp": 0.95,
    "types": 0.95,
    "number": 0.95,
    "set": 0.9,
    "setboxLetters": 0.95,
    "printYear": 0.95,
    "illustrator": 0.95,
    "text": 0.95
  }
}